{"timestamp":"2026-05-18T01:10:12.11726813Z","request_id":"930c931b-f4af-422b-89c4-bf1b7f2d137b","event_type":"PolicyDecision","user_info":{"username":"kubernetes-admin","groups":["kubeadm:cluster-admins","system:authenticated"],"extra":{"authentication.kubernetes.io/credential-id":["X509SHA256=286bb056f6dd2a105a544f8198cca92f50b1a52f8be6e2ee17608083120f0be3"]}},"namespace":"default","kind":{"group":"","version":"v1","kind":"Pod"},"name":"emergency-pod","operation":"CREATE","decision":"ALLOW","reason":"PolicyViolationSuppressedByException","message":"1 policy violation(s) suppressed by 1 exception(s); see suppressed_by for details","processing_time":6318083,"object":{"kind":"Pod","apiVersion":"v1","metadata":{"name":"emergency-pod","namespace":"default","uid":"13f9ccc2-9201-4f40-b1f2-639d4a6d2448","generation":1,"creationTimestamp":"2026-05-18T01:10:12Z","annotations":{"kubectl.kubernetes.io/last-applied-configuration":"{\"apiVersion\":\"v1\",\"kind\":\"Pod\",\"metadata\":{\"annotations\":{},\"name\":\"emergency-pod\",\"namespace\":\"default\"},\"spec\":{\"containers\":[{\"image\":\"nginx:1.27.0\",\"name\":\"app\",\"securityContext\":{\"allowPrivilegeEscalation\":false,\"runAsNonRoot\":true},\"volumeMounts\":[{\"mountPath\":\"/host\",\"name\":\"host-root\"}]}],\"volumes\":[{\"hostPath\":{\"path\":\"/tmp\"},\"name\":\"host-root\"}]}}\n"},"managedFields":[{"manager":"kubectl-client-side-apply","operation":"Update","apiVersion":"v1","time":"2026-05-18T01:10:12Z","fieldsType":"FieldsV1","fieldsV1":{"f:metadata":{"f:annotations":{".":{},"f:kubectl.kubernetes.io/last-applied-configuration":{}}},"f:spec":{"f:containers":{"k:{\"name\":\"app\"}":{".":{},"f:image":{},"f:imagePullPolicy":{},"f:name":{},"f:resources":{},"f:securityContext":{".":{},"f:allowPrivilegeEscalation":{},"f:runAsNonRoot":{}},"f:terminationMessagePath":{},"f:terminationMessagePolicy":{},"f:volumeMounts":{".":{},"k:{\"mountPath\":\"/host\"}":{".":{},"f:mountPath":{},"f:name":{}}}}},"f:dnsPolicy":{},"f:enableServiceLinks":{},"f:restartPolicy":{},"f:schedulerName":{},"f:securityContext":{},"f:terminationGracePeriodSeconds":{},"f:volumes":{".":{},"k:{\"name\":\"host-root\"}":{".":{},"f:hostPath":{".":{},"f:path":{},"f:type":{}},"f:name":{}}}}}}]},"spec":{"volumes":[{"name":"host-root","hostPath":{"path":"/tmp","type":""}},{"name":"kube-api-access-xgvxx","projected":{"sources":[{"serviceAccountToken":{"expirationSeconds":3607,"path":"token"}},{"configMap":{"name":"kube-root-ca.crt","items":[{"key":"ca.crt","path":"ca.crt"}]}},{"downwardAPI":{"items":[{"path":"namespace","fieldRef":{"apiVersion":"v1","fieldPath":"metadata.namespace"}}]}}],"defaultMode":420}}],"containers":[{"name":"app","image":"nginx:1.27.0","resources":{},"volumeMounts":[{"name":"host-root","mountPath":"/host"},{"name":"kube-api-access-xgvxx","readOnly":true,"mountPath":"/var/run/secrets/kubernetes.io/serviceaccount"}],"terminationMessagePath":"/dev/termination-log","terminationMessagePolicy":"File","imagePullPolicy":"IfNotPresent","securityContext":{"runAsNonRoot":true,"allowPrivilegeEscalation":false}}],"restartPolicy":"Always","terminationGracePeriodSeconds":30,"dnsPolicy":"ClusterFirst","serviceAccountName":"default","serviceAccount":"default","securityContext":{},"schedulerName":"default-scheduler","tolerations":[{"key":"node.kubernetes.io/not-ready","operator":"Exists","effect":"NoExecute","tolerationSeconds":300},{"key":"node.kubernetes.io/unreachable","operator":"Exists","effect":"NoExecute","tolerationSeconds":300}],"priority":0,"enableServiceLinks":true,"preemptionPolicy":"PreemptLowerPriority"},"status":{"phase":"Pending","qosClass":"BestEffort"}},"old_object":null,"suppressed_by":[{"ID":"crd:default:emergency-deployment","Name":"emergency-deployment","PolicyID":"security-baseline","RuleID":"no-host-path-volumes","Justification":"Emergency demo"}]}
